{
 "schema_version": "1.0",
 "id": "kdd",
 "conference": "KDD",
 "edition": "KDD 2025",
 "family": "data",
 "generated_by": "tools/build_templates.py (from analysis/template-inputs.json)",
 "data_basis": {
  "n_samples": 6,
  "n_measurements": 6,
  "focus_editions": [
   "2025",
   "2024",
   "2023",
   "2022"
  ],
  "measurement_method": "tools/measure_pdf.py (pdfminer.six 字形级几何)",
  "robust_stats_only": true
 },
 "sources": [
  {
   "kind": "official-source",
   "ref": "src-kdd-2025-researchtrack",
   "url": "https://kdd2025.kdd.org/research-track-call-for-papers/",
   "note": "KDD 2025 Research Track: Call for Papers"
  },
  {
   "kind": "official-source",
   "ref": "src-kdd-2024-researchtrack",
   "url": "https://kdd2024.kdd.org/research-track-call-for-papers/",
   "note": "KDD 2024 Research Track: Call for Papers"
  },
  {
   "kind": "official-source",
   "ref": "src-kdd-2023-callforresearch",
   "url": "https://kdd.org/kdd2023/call-for-research-track-papers/index.html",
   "note": "KDD 2023 Call for Research Track Papers"
  },
  {
   "kind": "official-source",
   "ref": "src-kdd-2022-cfp",
   "url": "https://kdd.org/kdd2022/cfpResearch.html",
   "note": "KDD 2022 Call for Research Track Papers"
  },
  {
   "kind": "official-source",
   "ref": "src-kdd-acmart-dtx",
   "url": "https://mirrors.tuna.tsinghua.edu.cn/CTAN/macros/latex/contrib/acmart/acmart.dtx",
   "note": "ACM acmart class (acmart.dtx documentation source)"
  },
  {
   "kind": "official-source",
   "ref": "src-kdd-acmrefformat-bst",
   "url": "https://mirrors.tuna.tsinghua.edu.cn/CTAN/macros/latex/contrib/acmart/ACM-Reference-Format.bst",
   "note": "ACM-Reference-Format.bst"
  },
  {
   "kind": "official-source",
   "ref": "src-kdd-2024-sample-001",
   "url": "https://arxiv.org/abs/2409.08978",
   "note": "Revisiting Local PageRank Estimation on Undirected Graphs: Simple and Optimal"
  },
  {
   "kind": "official-source",
   "ref": "src-kdd-2024-sample-002",
   "url": "https://arxiv.org/abs/2409.09930",
   "note": "Mining of Switching Sparse Networks for Missing Value Imputation in Multivariate Time Series"
  },
  {
   "kind": "official-source",
   "ref": "src-kdd-2024-sample-003",
   "url": "https://arxiv.org/abs/2409.06091",
   "note": "Scalable Multitask Learning Using Gradient-based Estimation of Task Affinity"
  },
  {
   "kind": "official-source",
   "ref": "src-kdd-2024-sample-004",
   "url": "https://arxiv.org/abs/2504.13192",
   "note": "CheatAgent: Attacking LLM-Empowered Recommender Systems via LLM Agent"
  },
  {
   "kind": "official-source",
   "ref": "src-kdd-2024-sample-005",
   "url": "https://arxiv.org/abs/2408.13727",
   "note": "LogParser-LLM: Advancing Efficient Log Parsing with Large Language Models"
  },
  {
   "kind": "official-source",
   "ref": "src-kdd-2024-sample-006",
   "url": "https://arxiv.org/abs/2606.25237",
   "note": "Extreme Meta-Classification for Large-Scale Zero-Shot Retrieval"
  },
  {
   "kind": "sample-pdf",
   "ref": "s-kdd-2024-001",
   "url": "https://arxiv.org/pdf/2409.08978",
   "note": "Revisiting Local PageRank Estimation on Undirected Graphs: Simple and Optimal"
  },
  {
   "kind": "sample-pdf",
   "ref": "s-kdd-2024-002",
   "url": "https://arxiv.org/pdf/2409.09930",
   "note": "Mining of Switching Sparse Networks for Missing Value Imputation in Multivariate Time Series"
  },
  {
   "kind": "sample-pdf",
   "ref": "s-kdd-2024-003",
   "url": "https://arxiv.org/pdf/2409.06091",
   "note": "Scalable Multitask Learning Using Gradient-based Estimation of Task Affinity"
  },
  {
   "kind": "sample-pdf",
   "ref": "s-kdd-2024-004",
   "url": "https://arxiv.org/pdf/2504.13192",
   "note": "CheatAgent: Attacking LLM-Empowered Recommender Systems via LLM Agent"
  },
  {
   "kind": "sample-pdf",
   "ref": "s-kdd-2024-005",
   "url": "https://arxiv.org/pdf/2408.13727",
   "note": "LogParser-LLM: Advancing Efficient Log Parsing with Large Language Models"
  },
  {
   "kind": "sample-pdf",
   "ref": "s-kdd-2024-006",
   "url": "https://arxiv.org/pdf/2606.25237",
   "note": "Extreme Meta-Classification for Large-Scale Zero-Shot Retrieval"
  },
  {
   "kind": "rule",
   "ref": "L-01",
   "url": null,
   "note": "页数上限针对“正文/技术内容页”，参考文献（多数会议）与附录不计入；不能简单地把上限当成 PDF 总页数。"
  },
  {
   "kind": "rule",
   "ref": "L-03",
   "url": null,
   "note": "全部 16 个会议均为双盲评审：稿件（含附录、补充材料）不得含身份信息。"
  },
  {
   "kind": "rule",
   "ref": "R-01",
   "url": null,
   "note": "Requirement 缺少“栏数”字段；16/16 会议都隐含栏数约束（1 或 2 栏）。"
  },
  {
   "kind": "analysis-file",
   "ref": "analysis/template-inputs.json",
   "url": null,
   "note": "稳健统计（median/P25/P75）来源"
  },
  {
   "kind": "analysis-file",
   "ref": "samples/_measurements/*.json",
   "url": null,
   "note": "单篇论文实测几何"
  }
 ],
 "traceability": {
  "basis_definitions": {
   "official": "官方指南/CFP/模板说明的明文字面值",
   "template-implied": "从官方 .sty/.cls 源码或官方模板文件读出（无文字明文）",
   "inferred": "由多源交叉推断（官方无明文，但模板行为 + 样本实测一致），可信度低于 template-implied",
   "sample-stat": "真实论文 PDF 实测的稳健统计（median/P25/P75），不是规则",
   "derived": "由前述值按固定公式推导（如 版心宽 = 行尾众数 − 行首最小值）"
  },
  "field_basis": {
   "hard_constraints.anonymity": "official",
   "hard_constraints.appendix_allowed": "official",
   "hard_constraints.appendix_counted": "official",
   "hard_constraints.bib_style": "template-implied",
   "hard_constraints.body_font_size_pt": "template-implied",
   "hard_constraints.camera_ready_extra_pages": "official",
   "hard_constraints.column_gap_mm": "template-implied",
   "hard_constraints.columns": "template-implied",
   "hard_constraints.margins_mm": "template-implied",
   "hard_constraints.page_limit_content": "official",
   "hard_constraints.page_limit_total": "official",
   "hard_constraints.paper_size": "template-implied",
   "hard_constraints.references_counted": "official",
   "hard_constraints.text_width_mm": "template-implied",
   "geometry.page_size": "template-implied",
   "geometry.page_width_mm": "derived",
   "geometry.page_height_mm": "derived",
   "geometry.columns": "official",
   "geometry.text_width_mm": "template-implied",
   "geometry.margin_floor_mm": "official",
   "geometry.margins.left_mm": "template-implied",
   "geometry.margins.right_mm": "template-implied",
   "geometry.margins.top_mm": "template-implied",
   "geometry.margins.bottom_mm": "template-implied",
   "geometry.column_gap_mm": "template-implied",
   "geometry.column_width_mm": "derived",
   "geometry.text_height_mm": "sample-stat",
   "typography.body_font_pt": "template-implied",
   "typography.caption_font_pt": "sample-stat",
   "typography.caption_position.figure": "sample-stat",
   "typography.caption_position.table": "sample-stat",
   "float_policy.float_spec": "derived",
   "float_policy.figure_width.overwide_threshold_mm": "derived",
   "density_targets.figures": "sample-stat",
   "density_targets.tables": "sample-stat",
   "density_targets.equations": "sample-stat",
   "density_targets.algorithms": "sample-stat",
   "density_targets.footnotes": "sample-stat",
   "density_targets.refs": "sample-stat",
   "density_targets.lines_per_page": "sample-stat",
   "density_targets.content_pages": "sample-stat"
  }
 },
 "hard_constraints": {
  "anonymity": {
   "value": "double-blind",
   "unit": null,
   "scope": "submission",
   "confidence": "official",
   "compliance_impact": "reject-risk",
   "evidence": [
    {
     "source_id": "src-kdd-2025-researchtrack",
     "quote": "The review process for the research track will be double-blind . The submitted document should omit any author names"
    }
   ],
   "note": "Research Track 双盲评审；正文不得含作者名/单位/致谢等身份信息，自引用第三人称"
  },
  "appendix_allowed": {
   "value": true,
   "unit": null,
   "scope": "both",
   "confidence": "official",
   "compliance_impact": "desk-check",
   "evidence": [
    {
     "source_id": "src-kdd-2025-researchtrack",
     "quote": "The Appendix can contain details on reproducibility, proofs, pseudo-code, etc."
    }
   ],
   "note": "允许附录（reproducibility 细节、证明、伪代码等）；投稿阶段附录无页数上限"
  },
  "appendix_counted": {
   "value": false,
   "unit": null,
   "scope": "submission",
   "confidence": "official",
   "compliance_impact": "desk-check",
   "evidence": [
    {
     "source_id": "src-kdd-2025-researchtrack",
     "quote": "followed by references and an optional Appendix that has no page limits"
    }
   ],
   "note": "投稿阶段附录不计入 8 页正文（无页数上限）；录用版参考文献+附录合计限 3 页"
  },
  "bib_style": {
   "value": "ACMReferenceFormat",
   "unit": null,
   "scope": "both",
   "confidence": "template-implied",
   "compliance_impact": "desk-check",
   "evidence": [
    {
     "source_id": "src-kdd-acmrefformat-bst",
     "quote": "filename        = \"ACM-Reference-Format.bst\""
    }
   ],
   "note": "acmart 随附 ACM-Reference-Format.bst；如投稿模板所要求"
  },
  "body_font_size_pt": {
   "value": 9,
   "unit": "pt",
   "scope": "both",
   "confidence": "template-implied",
   "compliance_impact": "reject-risk",
   "evidence": [
    {
     "source_id": "src-kdd-acmart-dtx",
     "quote": "\\or % sigconf\n    \\def\\ACM@fontsize{9pt}%"
    }
   ],
   "note": "acmart sigconf 默认正文字号 9pt"
  },
  "camera_ready_extra_pages": {
   "value": 1,
   "unit": "pages",
   "scope": "camera_ready",
   "confidence": "official",
   "compliance_impact": "reject-risk",
   "evidence": [
    {
     "source_id": "src-kdd-2025-researchtrack",
     "quote": "while we allow one more content page for accepted papers to incorporate reviewer feedback"
    },
    {
     "source_id": "src-kdd-2025-researchtrack",
     "quote": "we limit the references and Appendix to only 3 pages."
    }
   ],
   "note": "录用后正文可由 8 页增至 9 个 content pages（+1）"
  },
  "column_gap_mm": {
   "value": 8.47,
   "unit": "mm",
   "scope": "both",
   "confidence": "template-implied",
   "compliance_impact": "desk-check",
   "evidence": [
    {
     "source_id": "src-kdd-acmart-dtx",
     "quote": "includeheadfoot, columnsep=2pc,"
    }
   ],
   "note": "sigconf geometry columnsep=2pc；2pc = 24pt = 8.467mm"
  },
  "columns": {
   "value": 2,
   "unit": null,